{
  "$schema": "https://testatlas.dev/schemas/v1/issue.schema.json",
  "id": "ISSUE-003-mock-jwt-secret-in-env-example-reads-like-a-real-secret",
  "slug": "mock-jwt-secret-in-env-example-reads-like-a-real-secret",
  "title": "Mock JWT secret in env example reads like a real secret",
  "status": "new",
  "severity": "low",
  "confidence": "confirmed",
  "type": "documentation",
  "domain": "domain-auth",
  "flow": null,
  "environment": "local",
  "persona": "",
  "foundOn": "2026-05-03T00:00:00.000Z",
  "foundBy": "agent",
  "summary": ".env.example ships JWT_SECRET=replace-me-with-something-real which can be mistaken for an issued secret.",
  "expectedBehavior": "(to be filled)",
  "actualBehavior": "(to be filled)",
  "userImpact": "",
  "reproductionSteps": [],
  "frequency": "unknown",
  "evidence": [
    "EVIDENCE-003"
  ],
  "acceptanceCriteria": [
    "issue resolved per description"
  ],
  "lastUpdatedAt": "2026-05-03T00:00:00.000Z"
}
