{
  "$schema": "https://testatlas.dev/schemas/v1/issue.schema.json",
  "id": "ISSUE-003-signup-form-lacks-password-strength-validation",
  "slug": "signup-form-lacks-password-strength-validation",
  "title": "Signup form lacks password strength validation",
  "status": "new",
  "severity": "medium",
  "confidence": "confirmed",
  "type": "validation",
  "domain": "domain-auth",
  "flow": null,
  "environment": "local",
  "persona": "",
  "foundOn": "2026-05-03T00:00:00.000Z",
  "foundBy": "agent",
  "summary": "POST /api/auth/signup accepts any non-empty password; no length or complexity checks are applied.",
  "expectedBehavior": "(to be filled)",
  "actualBehavior": "(to be filled)",
  "userImpact": "",
  "reproductionSteps": [],
  "frequency": "unknown",
  "evidence": [
    "EVIDENCE-003"
  ],
  "acceptanceCriteria": [
    "issue resolved per description"
  ],
  "lastUpdatedAt": "2026-05-03T00:00:00.000Z"
}
