{
  "id": "ISSUE-002-broken-checkout",
  "slug": "broken-checkout",
  "title": "Checkout button returns 500 on retry",
  "status": "triaged",
  "severity": "critical",
  "confidence": "confirmed",
  "type": "functional",
  "domain": "domain-billing",
  "flow": "FLOW-billing-checkout",
  "environment": "staging",
  "persona": "shopper",
  "foundOn": "2026-05-03T13:00:00Z",
  "foundBy": "exploratory-agent",
  "summary": "Pressing checkout twice within 1s yields a 500 error and a stuck order.",
  "expectedBehavior": "Second click is debounced or returns the existing pending order.",
  "actualBehavior": "Server returns 500 and the order is left in 'pending' forever.",
  "userImpact": "Customer cannot complete purchase; revenue lost.",
  "reproductionSteps": ["Add item to cart", "Click checkout", "Click checkout again within 1s"],
  "frequency": "intermittent",
  "evidence": ["evidence/screenshots/checkout-500.png", "evidence/network/checkout.har"],
  "relatedFiles": ["src/checkout/api.ts"],
  "relatedCode": ["src/checkout/api.ts:42"],
  "suspectedRootCause": "Missing idempotency key on POST /checkout",
  "scope": "checkout endpoint only",
  "suggestedFixDirection": "Add request idempotency on the checkout API.",
  "acceptanceCriteria": [
    "Double-click on checkout returns 200 with same orderId",
    "No 500s in checkout logs"
  ],
  "retestNotes": [],
  "history": [{ "at": "2026-05-03T13:05:00Z", "action": "triaged" }],
  "lastUpdatedAt": "2026-05-03T13:30:00Z"
}
